{
  "schema_version": "edgar.portfolio.v1",
  "name": "S&P 500 coverage portfolio · top 100 companies",
  "holdings": [
    {
      "ticker": "NVDA",
      "weight_pct": 5,
      "cik": "0001045810"
    },
    {
      "ticker": "AAPL",
      "weight_pct": 5,
      "cik": "0000320193"
    },
    {
      "ticker": "MSFT",
      "weight_pct": 5,
      "cik": "0000789019"
    },
    {
      "ticker": "GOOGL",
      "weight_pct": 5,
      "cik": "0001652044"
    },
    {
      "ticker": "AMZN",
      "weight_pct": 5,
      "cik": "0001018724"
    },
    {
      "ticker": "AVGO",
      "weight_pct": 2,
      "cik": "0001730168"
    },
    {
      "ticker": "META",
      "weight_pct": 2,
      "cik": "0001326801"
    },
    {
      "ticker": "MU",
      "weight_pct": 2,
      "cik": "0000723125"
    },
    {
      "ticker": "TSLA",
      "weight_pct": 2,
      "cik": "0001318605"
    },
    {
      "ticker": "JPM",
      "weight_pct": 2,
      "cik": "0000019617"
    },
    {
      "ticker": "BRK-B",
      "weight_pct": 2,
      "cik": "0001067983"
    },
    {
      "ticker": "LLY",
      "weight_pct": 2,
      "cik": "0000059478"
    },
    {
      "ticker": "AMD",
      "weight_pct": 2,
      "cik": "0000002488"
    },
    {
      "ticker": "XOM",
      "weight_pct": 2,
      "cik": "0002115436"
    },
    {
      "ticker": "JNJ",
      "weight_pct": 2,
      "cik": "0000200406"
    },
    {
      "ticker": "V",
      "weight_pct": 2,
      "cik": "0001403161"
    },
    {
      "ticker": "INTC",
      "weight_pct": 2,
      "cik": "0000050863"
    },
    {
      "ticker": "WMT",
      "weight_pct": 2,
      "cik": "0000104169"
    },
    {
      "ticker": "MA",
      "weight_pct": 2,
      "cik": "0001141391"
    },
    {
      "ticker": "ABBV",
      "weight_pct": 2,
      "cik": "0001551152"
    },
    {
      "ticker": "CSCO",
      "weight_pct": 1,
      "cik": "0000858877"
    },
    {
      "ticker": "BAC",
      "weight_pct": 1,
      "cik": "0000070858"
    },
    {
      "ticker": "COST",
      "weight_pct": 1,
      "cik": "0000909832"
    },
    {
      "ticker": "CVX",
      "weight_pct": 1,
      "cik": "0000093410"
    },
    {
      "ticker": "PLTR",
      "weight_pct": 1,
      "cik": "0001321655"
    },
    {
      "ticker": "CAT",
      "weight_pct": 1,
      "cik": "0000018230"
    },
    {
      "ticker": "LRCX",
      "weight_pct": 1,
      "cik": "0000707549"
    },
    {
      "ticker": "AMAT",
      "weight_pct": 1,
      "cik": "0000006951"
    },
    {
      "ticker": "MRK",
      "weight_pct": 1,
      "cik": "0000310158"
    },
    {
      "ticker": "UNH",
      "weight_pct": 1,
      "cik": "0000731766"
    },
    {
      "ticker": "KO",
      "weight_pct": 1,
      "cik": "0000021344"
    },
    {
      "ticker": "PG",
      "weight_pct": 1,
      "cik": "0000080424"
    },
    {
      "ticker": "GE",
      "weight_pct": 1,
      "cik": "0000040545"
    },
    {
      "ticker": "NFLX",
      "weight_pct": 1,
      "cik": "0001065280"
    },
    {
      "ticker": "HD",
      "weight_pct": 1,
      "cik": "0000354950"
    },
    {
      "ticker": "GS",
      "weight_pct": 1,
      "cik": "0000886982"
    },
    {
      "ticker": "PM",
      "weight_pct": 1,
      "cik": "0001413329"
    },
    {
      "ticker": "WFC",
      "weight_pct": 1,
      "cik": "0000072971"
    },
    {
      "ticker": "PANW",
      "weight_pct": 1,
      "cik": "0001327567"
    },
    {
      "ticker": "RTX",
      "weight_pct": 1,
      "cik": "0000101829"
    },
    {
      "ticker": "GEV",
      "weight_pct": 1,
      "cik": "0001996810"
    },
    {
      "ticker": "MS",
      "weight_pct": 1,
      "cik": "0000895421"
    },
    {
      "ticker": "ORCL",
      "weight_pct": 1,
      "cik": "0001341439"
    },
    {
      "ticker": "TXN",
      "weight_pct": 1,
      "cik": "0000097476"
    },
    {
      "ticker": "SNDK",
      "weight_pct": 1,
      "cik": "0002023554"
    },
    {
      "ticker": "C",
      "weight_pct": 1,
      "cik": "0000831001"
    },
    {
      "ticker": "KLAC",
      "weight_pct": 1,
      "cik": "0000319201"
    },
    {
      "ticker": "IBM",
      "weight_pct": 1,
      "cik": "0000051143"
    },
    {
      "ticker": "TMO",
      "weight_pct": 1,
      "cik": "0000097745"
    },
    {
      "ticker": "LIN",
      "weight_pct": 1,
      "cik": "0001707925"
    },
    {
      "ticker": "VZ",
      "weight_pct": 0.3,
      "cik": "0000732712"
    },
    {
      "ticker": "CRWD",
      "weight_pct": 0.3,
      "cik": "0001535527"
    },
    {
      "ticker": "MRVL",
      "weight_pct": 0.3,
      "cik": "0001835632"
    },
    {
      "ticker": "APH",
      "weight_pct": 0.3,
      "cik": "0000820313"
    },
    {
      "ticker": "ANET",
      "weight_pct": 0.3,
      "cik": "0001596532"
    },
    {
      "ticker": "AMGN",
      "weight_pct": 0.3,
      "cik": "0000318154"
    },
    {
      "ticker": "CRM",
      "weight_pct": 0.3,
      "cik": "0001108524"
    },
    {
      "ticker": "QCOM",
      "weight_pct": 0.3,
      "cik": "0000804328"
    },
    {
      "ticker": "PEP",
      "weight_pct": 0.3,
      "cik": "0000077476"
    },
    {
      "ticker": "STX",
      "weight_pct": 0.3,
      "cik": "0001137789"
    },
    {
      "ticker": "DIS",
      "weight_pct": 0.3,
      "cik": "0001744489"
    },
    {
      "ticker": "ADI",
      "weight_pct": 0.3,
      "cik": "0000006281"
    },
    {
      "ticker": "T",
      "weight_pct": 0.3,
      "cik": "0000732717"
    },
    {
      "ticker": "MCD",
      "weight_pct": 0.3,
      "cik": "0000063908"
    },
    {
      "ticker": "GILD",
      "weight_pct": 0.3,
      "cik": "0000882095"
    },
    {
      "ticker": "ABT",
      "weight_pct": 0.3,
      "cik": "0000001800"
    },
    {
      "ticker": "SCHW",
      "weight_pct": 0.3,
      "cik": "0000316709"
    },
    {
      "ticker": "AXP",
      "weight_pct": 0.3,
      "cik": "0000004962"
    },
    {
      "ticker": "NEE",
      "weight_pct": 0.3,
      "cik": "0000753308"
    },
    {
      "ticker": "DE",
      "weight_pct": 0.3,
      "cik": "0000315189"
    },
    {
      "ticker": "UNP",
      "weight_pct": 0.3,
      "cik": "0000100885"
    },
    {
      "ticker": "COP",
      "weight_pct": 0.3,
      "cik": "0001163165"
    },
    {
      "ticker": "WELL",
      "weight_pct": 0.3,
      "cik": "0000766704"
    },
    {
      "ticker": "BA",
      "weight_pct": 0.3,
      "cik": "0000012927"
    },
    {
      "ticker": "ETN",
      "weight_pct": 0.3,
      "cik": "0001551182"
    },
    {
      "ticker": "DELL",
      "weight_pct": 0.3,
      "cik": "0001571996"
    },
    {
      "ticker": "PFE",
      "weight_pct": 0.3,
      "cik": "0000078003"
    },
    {
      "ticker": "BLK",
      "weight_pct": 0.3,
      "cik": "0002012383"
    },
    {
      "ticker": "WDC",
      "weight_pct": 0.3,
      "cik": "0000106040"
    },
    {
      "ticker": "UBER",
      "weight_pct": 0.3,
      "cik": "0001543151"
    },
    {
      "ticker": "TJX",
      "weight_pct": 0.3,
      "cik": "0000109198"
    },
    {
      "ticker": "NOW",
      "weight_pct": 0.3,
      "cik": "0001373715"
    },
    {
      "ticker": "NEM",
      "weight_pct": 0.3,
      "cik": "0001164727"
    },
    {
      "ticker": "BKNG",
      "weight_pct": 0.3,
      "cik": "0001075531"
    },
    {
      "ticker": "VRTX",
      "weight_pct": 0.3,
      "cik": "0000875320"
    },
    {
      "ticker": "ISRG",
      "weight_pct": 0.3,
      "cik": "0001035267"
    },
    {
      "ticker": "GLW",
      "weight_pct": 0.3,
      "cik": "0000024741"
    },
    {
      "ticker": "BMY",
      "weight_pct": 0.3,
      "cik": "0000014272"
    },
    {
      "ticker": "COF",
      "weight_pct": 0.3,
      "cik": "0000927628"
    },
    {
      "ticker": "PLD",
      "weight_pct": 0.3,
      "cik": "0001045609"
    },
    {
      "ticker": "PGR",
      "weight_pct": 0.3,
      "cik": "0000080661"
    },
    {
      "ticker": "DHR",
      "weight_pct": 0.3,
      "cik": "0000313616"
    },
    {
      "ticker": "SPGI",
      "weight_pct": 0.3,
      "cik": "0000064040"
    },
    {
      "ticker": "CB",
      "weight_pct": 0.3,
      "cik": "0000896159"
    },
    {
      "ticker": "CVS",
      "weight_pct": 0.3,
      "cik": "0000064803"
    },
    {
      "ticker": "PH",
      "weight_pct": 0.3,
      "cik": "0000076334"
    },
    {
      "ticker": "MDT",
      "weight_pct": 0.3,
      "cik": "0001613103"
    },
    {
      "ticker": "VLO",
      "weight_pct": 0.3,
      "cik": "0001035002"
    },
    {
      "ticker": "MPC",
      "weight_pct": 0.3,
      "cik": "0001510295"
    },
    {
      "ticker": "MO",
      "weight_pct": 0.3,
      "cik": "0000764180"
    }
  ],
  "allocation": {
    "basis": "weights",
    "normalize": false
  },
  "research": {
    "basis": "annual"
  }
}
